{
  "schema": "ihat://identity/revocation-event/v1",
  "id": "revocation-event/session-001",
  "revision": 1,
  "created_at": "2026-08-03T01:00:20.000Z",
  "updated_at": "2026-08-03T01:00:20.000Z",
  "digest": "sha256:e6e876cab02916fbafb4d74c22bd0a783c44f1cee3ae3e82a14cc88ea0d337f4",
  "aggregate_type": "session",
  "aggregate_id": "session-record/nerp-001",
  "subject_reference_digest": "sha256:aaaaaaaaaaaaaaaaaaaaaaaaaaaaaaaaaaaaaaaaaaaaaaaaaaaaaaaaaaaaaaaa",
  "reason": "user-request",
  "actor_type": "subject",
  "actor_id": "subject/person-001",
  "event_sequence": 1,
  "revocation_epoch": 1,
  "effective_at": "2026-08-03T01:00:20.000Z",
  "correlation_id": "correlation/logout-request-001"
}
